{
  "version": 1,
  "sampleCount": 3,
  "files": [
    { "path": "staff.csv", "format": "csv", "size": 2048 },
    { "path": "tickets.json", "format": "json", "size": 4096 },
    { "path": "notes.md", "format": "markdown", "size": 512 },
    { "path": "standup.vtt", "format": "vtt", "size": 1024 }
  ],
  "tables": [
    {
      "file": "staff.csv",
      "headerRow": 1,
      "columns": [
        {
          "header": "Owner",
          "stats": {
            "count": 40, "distinctRatio": 0.6, "digitRatio": 0, "dictionaryRatio": 0.05, "meanLength": 11.2,
            "detectorRates": { "ip": 0, "email": 0, "host": 0, "guid": 0, "mac": 0 },
            "samples": ["Avery Quill", "Robin Example", "Sam Placeholder"]
          }
        },
        {
          "header": "Server IP",
          "stats": {
            "count": 40, "distinctRatio": 0.9, "digitRatio": 0.8, "dictionaryRatio": 0, "meanLength": 11,
            "detectorRates": { "ip": 1, "email": 0, "host": 0, "guid": 0, "mac": 0 },
            "samples": ["192.0.2.10", "198.51.100.7"]
          }
        }
      ]
    }
  ],
  "jsonKeys": [
    {
      "file": "tickets.json",
      "path": "$.items[*].ref_code",
      "stats": {
        "count": 12, "distinctRatio": 1, "digitRatio": 0.5, "dictionaryRatio": 0, "meanLength": 8,
        "detectorRates": { "ip": 0, "email": 0, "host": 0, "guid": 0, "mac": 0 },
        "samples": ["PRJ-0001", "PRJ-0002"]
      }
    }
  ],
  "documents": [
    { "file": "notes.md", "outline": ["Overview", "Next steps"], "sampleSentences": ["Avery Quill will migrate db01.example.com on Friday."] }
  ],
  "transcripts": [
    { "file": "standup.vtt", "speakers": ["Avery Quill", "Robin Example"], "sampleLines": ["Robin Example: the Example Widgets demo moved to Tuesday."] }
  ],
  "cooccurrence": [
    { "a": { "file": "staff.csv", "header": "Owner" }, "b": { "file": "tickets.json", "jsonPath": "$.items[*].assignee" }, "shared": 7 }
  ]
}
